{
  "id": "ZWAZGQPXGN82RY9Q5D5TCA9WNF",
  "rev": "TS41RTX0ESJ1QGN3M264WVN22Y",
  "schema_version": 1,
  "type": "fact",
  "scope": "project",
  "scope_path": ".",
  "title": "Primary datastore",
  "body": "The primary datastore is PostgreSQL 16, reachable on port 5432. Connection settings live in config/database.yml.",
  "summary": "Primary datastore is PostgreSQL 16 on port 5432.",
  "tags": ["database", "infra"],
  "dedup_key": "fact:primary-datastore",
  "content_hash": "sha256:6c1d890d55121e794e4b4e1e6791c2fba8ad1be00e745efd84455c324beba81d",
  "provenance": { "source": "user", "tool": "claude-code", "author": "asuran" },
  "salience": 0.8,
  "confidence": 1,
  "created_at": "2026-09-20T10:00:00Z",
  "updated_at": "2026-09-20T10:00:00Z",
  "status": "active",
  "hlc": "001758362400000:000000:laptop-a",
  "sensitivity": "public"
}
