{
  "id": "WW1YTV06JNYG0E3QKN0YAAVJWH",
  "rev": "AAGXSEJA6JJAHC0QWRTKHXN08V",
  "schema_version": 1,
  "type": "task",
  "scope": "project",
  "scope_path": ".",
  "title": "Migrate to pnpm 11",
  "body": "Upgrade the monorepo to pnpm 11 and regenerate the lockfile. Blocked on the CI image bump.",
  "summary": "Upgrade to pnpm 11 (blocked on CI image bump).",
  "tags": ["chore", "ci"],
  "content_hash": "sha256:5ab851fc3116940391b6c27a92cda8739ee834ba63b14223190bc56a0f339de4",
  "provenance": { "source": "user" },
  "salience": 0.5,
  "confidence": 1,
  "decay": { "ttl_at": "2026-12-31T00:00:00Z", "pinned": false },
  "created_at": "2026-09-22T12:00:00Z",
  "updated_at": "2026-09-22T12:00:00Z",
  "status": "active",
  "hlc": "001758542400000:000000:laptop-a",
  "sensitivity": "public"
}
